{
    "$schema":  "../../studio/game-profile.schema.json",
    "schemaVersion":  "1.0",
    "id":  "puzzle",
    "displayName":  "Puzzle",
    "engine":  "Unity",
    "genres":  [
                   "puzzle"
               ],
    "coreLoop":  [
                     "Read board",
                     "Make move",
                     "Resolve feedback",
                     "Complete objective",
                     "Unlock next content"
                 ],
    "releaseScopeRequirements":  [
                                     {
                                         "id":  "vertical-content",
                                         "type":  "content",
                                         "description":  "Representative final-quality vertical-slice content",
                                         "minimumPlannedCount":  1,
                                         "requiredFor":  "vertical-slice"
                                     },
                                     {
                                         "id":  "level-library",
                                         "type":  "content",
                                         "description":  "Curated levels with objectives, difficulty, and validation",
                                         "minimumPlannedCount":  40,
                                         "requiredFor":  "content-complete"
                                     },
                                     {
                                         "id":  "puzzle-rules",
                                         "type":  "feature",
                                         "description":  "Complete rule, hint, fail, retry, and progression loop",
                                         "minimumPlannedCount":  1,
                                         "requiredFor":  "vertical-slice"
                                     },
                                     {
                                         "id":  "level-validation",
                                         "type":  "configuration",
                                         "description":  "Level data and automated solvability/constraint validation",
                                         "minimumPlannedCount":  1,
                                         "requiredFor":  "alpha"
                                     },
                                     {
                                         "id":  "tutorial-first-session",
                                         "type":  "tutorial",
                                         "description":  "First-session guided journey",
                                         "minimumPlannedCount":  1,
                                         "requiredFor":  "vertical-slice"
                                     },
                                     {
                                         "id":  "ui-production",
                                         "type":  "ui-screen",
                                         "description":  "Complete production UI inventory",
                                         "minimumPlannedCount":  1,
                                         "requiredFor":  "vertical-slice"
                                     },
                                     {
                                         "id":  "config-production",
                                         "type":  "configuration",
                                         "description":  "Designer-editable production configuration",
                                         "minimumPlannedCount":  1,
                                         "requiredFor":  "vertical-slice"
                                     },
                                     {
                                         "id":  "art-production",
                                         "type":  "art",
                                         "description":  "Formal in-game approved art sets",
                                         "minimumPlannedCount":  1,
                                         "requiredFor":  "vertical-slice"
                                     },
                                     {
                                         "id":  "audio-production",
                                         "type":  "audio",
                                         "description":  "Music, SFX, and feedback audio sets",
                                         "minimumPlannedCount":  1,
                                         "requiredFor":  "vertical-slice"
                                     },
                                     {
                                         "id":  "operations-readiness",
                                         "type":  "operations",
                                         "description":  "Game-side operations and publishing handoffs",
                                         "minimumPlannedCount":  1,
                                         "requiredFor":  "release-candidate"
                                     },
                                     {
                                         "id":  "release-build",
                                         "type":  "build",
                                         "description":  "Verified target-platform release build",
                                         "minimumPlannedCount":  1,
                                         "requiredFor":  "release"
                                     }
                                 ],
    "requiredUiScreens":  [
                              "main-menu",
                              "level-select",
                              "gameplay-hud",
                              "pause",
                              "results",
                              "settings"
                          ],
    "onboardingBeats":  [
                            "Make first move",
                            "Explain objective",
                            "Show invalid move",
                            "Use first hint",
                            "Complete first level"
                        ],
    "configurationSources":  [
                                 "levels",
                                 "objectives",
                                 "difficulty",
                                 "hints",
                                 "localization"
                             ],
    "artSets":  [
                    "tiles",
                    "boards",
                    "backgrounds",
                    "hud",
                    "level-select",
                    "vfx"
                ],
    "audioSets":  [
                      "music",
                      "ui-sfx",
                      "move-sfx",
                      "success-failure-sfx"
                  ],
    "performanceBudgets":  {
                               "targetFps":  60,
                               "maxFrameMs":  16.67,
                               "maxMemoryMb":  512
                           },
    "unityChecks":  [
                        "Unity compile passes",
                        "Level data validation passes",
                        "First-session levels pass",
                        "Target-platform package smoke passes at Release Candidate or on explicit owner request"
                    ],
    "presentationDefaults":  {
                                      "dimension":  "2d",
                                      "pureUIGame":  false,
                                      "coreGameplayRenderer":  "sprite-scene",
                                      "uiRenderer":  "ugui"
                                  },
    "selectedAt":  "",
    "projectOverrides":  [

                         ]
}
