{
    "$schema":  "../../studio/game-profile.schema.json",
    "schemaVersion":  "1.0",
    "id":  "card-roguelike",
    "displayName":  "Card Roguelike",
    "engine":  "Unity",
    "genres":  [
                   "card",
                   "roguelike"
               ],
    "coreLoop":  [
                     "Choose rewards",
                     "Build deck",
                     "Resolve encounters",
                     "Advance run",
                     "Unlock meta progression"
                 ],
    "releaseScopeRequirements":  [
                                     {
                                         "id":  "vertical-content",
                                         "type":  "content",
                                         "description":  "Representative final-quality vertical-slice content",
                                         "minimumPlannedCount":  1,
                                         "requiredFor":  "vertical-slice"
                                     },
                                     {
                                         "id":  "card-library",
                                         "type":  "content",
                                         "description":  "Playable cards with art, rules, upgrades, and localization",
                                         "minimumPlannedCount":  30,
                                         "requiredFor":  "content-complete"
                                     },
                                     {
                                         "id":  "encounter-library",
                                         "type":  "content",
                                         "description":  "Normal, elite, event, boss, and reward encounters",
                                         "minimumPlannedCount":  12,
                                         "requiredFor":  "content-complete"
                                     },
                                     {
                                         "id":  "run-progression",
                                         "type":  "feature",
                                         "description":  "Run map, rewards, fail/restart, and meta progression",
                                         "minimumPlannedCount":  1,
                                         "requiredFor":  "vertical-slice"
                                     },
                                     {
                                         "id":  "tutorial-first-session",
                                         "type":  "tutorial",
                                         "description":  "First-session guided journey",
                                         "minimumPlannedCount":  1,
                                         "requiredFor":  "vertical-slice"
                                     },
                                     {
                                         "id":  "ui-production",
                                         "type":  "ui-screen",
                                         "description":  "Complete production UI inventory",
                                         "minimumPlannedCount":  1,
                                         "requiredFor":  "vertical-slice"
                                     },
                                     {
                                         "id":  "config-production",
                                         "type":  "configuration",
                                         "description":  "Designer-editable production configuration",
                                         "minimumPlannedCount":  1,
                                         "requiredFor":  "vertical-slice"
                                     },
                                     {
                                         "id":  "art-production",
                                         "type":  "art",
                                         "description":  "Formal in-game approved art sets",
                                         "minimumPlannedCount":  1,
                                         "requiredFor":  "vertical-slice"
                                     },
                                     {
                                         "id":  "audio-production",
                                         "type":  "audio",
                                         "description":  "Music, SFX, and feedback audio sets",
                                         "minimumPlannedCount":  1,
                                         "requiredFor":  "vertical-slice"
                                     },
                                     {
                                         "id":  "operations-readiness",
                                         "type":  "operations",
                                         "description":  "Game-side operations and publishing handoffs",
                                         "minimumPlannedCount":  1,
                                         "requiredFor":  "release-candidate"
                                     },
                                     {
                                         "id":  "release-build",
                                         "type":  "build",
                                         "description":  "Verified target-platform release build",
                                         "minimumPlannedCount":  1,
                                         "requiredFor":  "release"
                                     }
                                 ],
    "requiredUiScreens":  [
                              "main-menu",
                              "run-map",
                              "combat-hud",
                              "deck-view",
                              "card-reward",
                              "settings",
                              "results"
                          ],
    "onboardingBeats":  [
                            "First interaction",
                            "First card play",
                            "First reward choice",
                            "First deck change",
                            "First failure and restart"
                        ],
    "configurationSources":  [
                                 "card-definitions",
                                 "encounters",
                                 "rewards",
                                 "difficulty",
                                 "localization"
                             ],
    "artSets":  [
                    "cards",
                    "characters",
                    "environments",
                    "combat-ui",
                    "meta-ui",
                    "vfx"
                ],
    "audioSets":  [
                      "music",
                      "ui-sfx",
                      "card-sfx",
                      "combat-sfx"
                  ],
    "performanceBudgets":  {
                               "targetFps":  60,
                               "maxFrameMs":  16.67,
                               "maxMemoryMb":  1024
                           },
    "unityChecks":  [
                        "Unity compile passes",
                        "Representative run is playable",
                        "No missing references",
                        "Target-platform package smoke passes at Release Candidate or on explicit owner request"
                    ],
    "presentationDefaults":  {
                                      "dimension":  "2d",
                                      "pureUIGame":  false,
                                      "coreGameplayRenderer":  "sprite-scene",
                                      "uiRenderer":  "ugui"
                                  },
    "selectedAt":  "",
    "projectOverrides":  [

                         ]
}
